vteIndonesia articles,vteIndonesia articles.1
History,Timeline Prehistory Hindu-Buddhist era Spread of Islam Portuguese era (1512–1605) VOC era (1603–1800) French and British era (1806–1816) Dutch East Indies (1800–1949) Japanese occupation (1942–1945) National Revolution (1945–1949) Liberal democracy era (1950–1959) Guided Democracy era (1959–1966) Transitional era (1965–1968) New Order (1966–1998) Reformasi (since 1998)
Geography,Borders Climate Climate change Conservation Biosphere reserves National parks Deforestation Earthquakes Environmental issues Geology Islands Lakes Mountains Provincial highest points Natural history Fauna Flora Regions Rivers Volcanoes
Borders Climate Climate change Conservation Biosphere reserves National parks Deforestation Earthquakes Environmental issues Geology Islands Lakes Mountains Provincial highest points Natural history Fauna Flora Regions Rivers Volcanoes,Borders Climate Climate change Conservation Biosphere reserves National parks Deforestation Earthquakes Environmental issues Geology Islands Lakes Mountains Provincial highest points Natural history Fauna Flora Regions Rivers Volcanoes
Politics,Administrative divisions Historical Provinces Regencies and cities Districts Cabinet Constitution Corruption Elections Foreign relations Human rights Law Censorship Enforcement Military (Babinsa) National capital Pancasila People's Consultative Assembly Police Political parties President (List) Wawasan Nusantara
Administrative divisions Historical Provinces Regencies and cities Districts Cabinet Constitution Corruption Elections Foreign relations Human rights Law Censorship Enforcement Military (Babinsa) National capital Pancasila People's Consultative Assembly Police Political parties President (List) Wawasan Nusantara,Administrative divisions Historical Provinces Regencies and cities Districts Cabinet Constitution Corruption Elections Foreign relations Human rights Law Censorship Enforcement Military (Babinsa) National capital Pancasila People's Consultative Assembly Police Political parties President (List) Wawasan Nusantara
Economy,Agriculture Automotive Aviation Banks Energy History Postal codes Rupiah Science and technology Stock exchange Telecommunications Telephone numbers Tourism Transport Water supply and sanitation
Agriculture Automotive Aviation Banks Energy History Postal codes Rupiah Science and technology Stock exchange Telecommunications Telephone numbers Tourism Transport Water supply and sanitation,Agriculture Automotive Aviation Banks Energy History Postal codes Rupiah Science and technology Stock exchange Telecommunications Telephone numbers Tourism Transport Water supply and sanitation
Society,Abortion Crime Human trafficking Migrant workers Piracy Prostitution Smoking Culture Architecture Candi Colonial Mosques Rumah adat Art Batik Cinema Costume Cuisine Dance Festivals Legends Libraries Literature Martial arts Media Music Mythology National heroes National Pedestrian Day Painting Properties Public holidays Sport Theatre Video games Demographics Education Ethnic groups Indonesian Health Healthcare Homelessness Languages Refugees Women LGBT rights Religion Islam Christianity Catholicism Protestantism Hinduism Buddhism Confucianism Judaism Sikhism Symbols Anthem Costume Emblem Historical Subdivision Faunal emblems Flag Subdivision Floral emblems Motto Nusantara Personification Songs
Abortion Crime Human trafficking Migrant workers Piracy Prostitution Smoking,Abortion Crime Human trafficking Migrant workers Piracy Prostitution Smoking
Culture,Architecture Candi Colonial Mosques Rumah adat Art Batik Cinema Costume Cuisine Dance Festivals Legends Libraries Literature Martial arts Media Music Mythology National heroes National Pedestrian Day Painting Properties Public holidays Sport Theatre Video games
Demographics,Education Ethnic groups Indonesian Health Healthcare Homelessness Languages Refugees Women LGBT rights
Religion,Islam Christianity Catholicism Protestantism Hinduism Buddhism Confucianism Judaism Sikhism
Symbols,Anthem Costume Emblem Historical Subdivision Faunal emblems Flag Subdivision Floral emblems Motto Nusantara Personification Songs
Outline Category Portal Gallery Atlas,Outline Category Portal Gallery Atlas
